{
  "name": "my-workflow",
  "template": "example-value",
  "arguments": "example-value",
  "dependencies": [
    "example-value",
    "example-value"
  ],
  "when": "example-value",
  "withItems": [
    "example-value",
    "example-value"
  ],
  "withParam": "example-value",
  "continueOn": {
    "error": true,
    "failed": true
  }
}